{
  "run_id": "buggy-routing-002",
  "task": "Fix the failing checkout test by updating the payments client.",
  "model": "fixture-worker",
  "iterations": [
    {
      "index": 0,
      "thought": "Read the failing test to find the right module.",
      "steps": [
        {
          "step_id": "iter0.step0.read-test",
          "action_type": "tool_call",
          "tool_name": "read_file",
          "input": "tests/test_checkout.py",
          "output": "assert payments.charge(order).status == 'ok'",
          "status": "ok",
          "tokens": 14
        },
        {
          "step_id": "iter0.step1.edit-shipping",
          "action_type": "tool_call",
          "tool_name": "edit_file",
          "input": "Modify shipping/client.py retry logic.",
          "output": "Edited shipping/client.py (unrelated to the failing payments test).",
          "status": "ok",
          "tokens": 16
        }
      ]
    },
    {
      "index": 1,
      "steps": [
        {
          "step_id": "iter1.step0.final",
          "action_type": "final",
          "output": "Updated retry handling.",
          "status": "ok",
          "tokens": 7
        }
      ]
    }
  ],
  "planted_failure": {
    "step_id": "iter0.step1.edit-shipping",
    "failure_type": "routing",
    "description": "The agent routes the fix to the shipping module instead of the payments client named by the failing test; the wrong-target edit is the local fault."
  }
}
