{
  "run_id": "clean_palindrome_001",
  "task": "Implement is_palindrome(s).",
  "model": "synthetic_worker_v0",
  "iterations": [
    {
      "index": 0,
      "thought": "Read the palindrome task specification and focused tests.",
      "steps": [
        {
          "step_id": "a0",
          "action_type": "tool_call",
          "tool_name": "read_file",
          "input": {
            "path": "tasks/specs/is_palindrome.md"
          },
          "output": "Spec requires is_palindrome(s) to ignore case, punctuation, and whitespace.",
          "status": "ok",
          "tokens": 240
        },
        {
          "step_id": "a1",
          "action_type": "tool_call",
          "tool_name": "read_file",
          "input": {
            "path": "tests/test_is_palindrome.py"
          },
          "output": "Focused tests cover empty strings, mixed punctuation, Unicode-safe alphanumerics, and negative cases.",
          "status": "ok",
          "tokens": 200
        }
      ]
    },
    {
      "index": 1,
      "thought": "Implement the palindrome helper.",
      "steps": [
        {
          "step_id": "a2",
          "action_type": "tool_call",
          "tool_name": "write_file",
          "input": {
            "path": "src/palindrome.py",
            "content_summary": "Two-pointer palindrome implementation after filtering alphanumerics."
          },
          "output": "Wrote is_palindrome(s) by filtering alphanumeric characters and comparing with two pointers.",
          "status": "ok",
          "tokens": 510
        }
      ]
    },
    {
      "index": 2,
      "thought": "Run the focused palindrome tests.",
      "steps": [
        {
          "step_id": "a3",
          "action_type": "tool_call",
          "tool_name": "run_tests",
          "input": {
            "command": "pytest tests/test_is_palindrome.py"
          },
          "output": "6 passed in 0.02s",
          "status": "ok",
          "tokens": 225
        }
      ]
    },
    {
      "index": 3,
      "thought": "Submit the completed palindrome helper.",
      "steps": [
        {
          "step_id": "a4",
          "action_type": "final",
          "tool_name": "submit",
          "input": {
            "files": [
              "src/palindrome.py"
            ]
          },
          "output": "Submitted is_palindrome implementation.",
          "status": "ok",
          "tokens": 140
        }
      ]
    }
  ],
  "planted_failure": null
}
