{
  "run_id": "clean-trace-001",
  "task": "Add a null guard to the profile avatar renderer.",
  "model": "fixture-worker",
  "iterations": [
    {
      "index": 0,
      "thought": "Inspect the avatar component and patch only the missing guard.",
      "steps": [
        {
          "step_id": "iter0.step0.read-avatar",
          "action_type": "tool_call",
          "tool_name": "read_file",
          "input": "components/ProfileAvatar.tsx",
          "output": "const url = user.avatar.url;",
          "status": "ok",
          "tokens": 10
        },
        {
          "step_id": "iter0.step1.add-guard",
          "action_type": "tool_call",
          "tool_name": "edit_file",
          "input": "components/ProfileAvatar.tsx",
          "output": "const url = user.avatar?.url ?? DEFAULT_AVATAR_URL;",
          "status": "ok",
          "tokens": 13
        }
      ]
    },
    {
      "index": 1,
      "steps": [
        {
          "step_id": "iter1.step0.final",
          "action_type": "final",
          "output": "Added the avatar null guard.",
          "status": "ok",
          "tokens": 5
        }
      ]
    }
  ],
  "planted_failure": null
}

