{
  "run_id": "clean-003",
  "task": "Add a docstring to the retry helper.",
  "model": "fixture-worker",
  "iterations": [
    {
      "index": 0,
      "thought": "Locate the helper, then document it.",
      "steps": [
        {
          "step_id": "iter0.step0.read-file",
          "action_type": "tool_call",
          "tool_name": "read_file",
          "input": "utils/retry.py",
          "output": "def retry(fn, attempts=3): ...",
          "status": "ok",
          "tokens": 10
        },
        {
          "step_id": "iter0.step1.add-docstring",
          "action_type": "tool_call",
          "tool_name": "edit_file",
          "input": "Add a one-line docstring to retry().",
          "output": "Added docstring to utils/retry.py.",
          "status": "ok",
          "tokens": 11
        }
      ]
    },
    {
      "index": 1,
      "steps": [
        {
          "step_id": "iter1.step0.final",
          "action_type": "final",
          "output": "Documented the retry helper.",
          "status": "ok",
          "tokens": 6
        }
      ]
    }
  ],
  "planted_failure": null
}
